{
  "schemaVersion": 1,
  "fixture": "synthetic-csharp",
  "state": "delete-file",
  "commit": "3206c2c48111ca803f9515ffb9d4862bf3c3946a",
  "tokensaveVersion": "7.16.0",
  "files": [
    {
      "path": "docs/architecture.md",
      "encoding": "utf-8",
      "lineEnding": "lf",
      "extracted": true
    },
    {
      "path": "src/Domain/Events/OrderPlaced.cs",
      "encoding": "utf-8",
      "lineEnding": "lf",
      "extracted": true
    },
    {
      "path": "src/Domain/Generics/Collections.cs",
      "encoding": "utf-8",
      "lineEnding": "lf",
      "extracted": true
    },
    {
      "path": "src/Domain/Generics/Repository.cs",
      "encoding": "utf-8",
      "lineEnding": "lf",
      "extracted": true
    },
    {
      "path": "src/Domain/Money.cs",
      "encoding": "utf-8",
      "lineEnding": "lf",
      "extracted": true
    },
    {
      "path": "src/Domain/Order.Totals.cs",
      "encoding": "utf-8",
      "lineEnding": "lf",
      "extracted": true
    },
    {
      "path": "src/Domain/Order.cs",
      "encoding": "utf-8",
      "lineEnding": "lf",
      "extracted": true
    },
    {
      "path": "src/Domain/Order.readme.md",
      "encoding": "utf-8",
      "lineEnding": "lf",
      "extracted": true
    },
    {
      "path": "src/Domain/OrderLine.cs",
      "encoding": "utf-8",
      "lineEnding": "lf",
      "extracted": true
    },
    {
      "path": "src/Extensions/ServiceCollectionExtensions.cs",
      "encoding": "utf-8",
      "lineEnding": "lf",
      "extracted": true
    },
    {
      "path": "src/Extensions/StringExtensions.cs",
      "encoding": "utf-8",
      "lineEnding": "lf",
      "extracted": true
    },
    {
      "path": "src/Infrastructure/BomMarker.cs",
      "encoding": "utf-8-bom",
      "lineEnding": "lf",
      "extracted": true
    },
    {
      "path": "src/Infrastructure/CrlfMarker.cs",
      "encoding": "utf-8",
      "lineEnding": "crlf",
      "extracted": true
    },
    {
      "path": "src/Infrastructure/DependencyInjection.cs",
      "encoding": "utf-8",
      "lineEnding": "lf",
      "extracted": true
    },
    {
      "path": "src/Infrastructure/Latin1Marker.cs",
      "encoding": "latin-1",
      "lineEnding": "lf",
      "extracted": true
    },
    {
      "path": "src/Infrastructure/Utf16Marker.cs",
      "encoding": "utf-16le",
      "lineEnding": "lf",
      "extracted": true
    },
    {
      "path": "src/Program.cs",
      "encoding": "utf-8",
      "lineEnding": "lf",
      "extracted": true
    },
    {
      "path": "src/Services/EmailNotifier.cs",
      "encoding": "utf-8",
      "lineEnding": "lf",
      "extracted": true
    },
    {
      "path": "src/Services/INotifier.cs",
      "encoding": "utf-8",
      "lineEnding": "lf",
      "extracted": true
    },
    {
      "path": "src/Services/IOrderService.cs",
      "encoding": "utf-8",
      "lineEnding": "lf",
      "extracted": true
    },
    {
      "path": "src/Services/OrderFormatter.cs",
      "encoding": "utf-8",
      "lineEnding": "lf",
      "extracted": true
    },
    {
      "path": "src/Services/OrderService.cs",
      "encoding": "utf-8",
      "lineEnding": "lf",
      "extracted": true
    },
    {
      "path": "tokensave-docs/legacy-pricing.md",
      "encoding": "utf-8",
      "lineEnding": "lf",
      "extracted": true
    },
    {
      "path": "tokensave-docs/orders-overview.md",
      "encoding": "utf-8",
      "lineEnding": "lf",
      "extracted": true
    }
  ],
  "symbols": [
    {
      "path": "docs/architecture.md",
      "qualifiedName": "Architecture",
      "kind": "module",
      "signature": "# Architecture",
      "startLine": 1,
      "endLine": 2
    },
    {
      "path": "src/Domain/Events/OrderPlaced.cs",
      "qualifiedName": "OrderPlaced",
      "kind": "record",
      "signature": "public record OrderPlaced(Guid OrderId, DateTimeOffset At)",
      "startLine": 3,
      "endLine": 3
    },
    {
      "path": "src/Domain/Generics/Collections.cs",
      "qualifiedName": "Cache",
      "kind": "class",
      "signature": "public class Cache\u003CTKey\u003E",
      "startLine": 3,
      "endLine": 11
    },
    {
      "path": "src/Domain/Generics/Collections.cs",
      "qualifiedName": "Cache::Entry",
      "kind": "inner_class",
      "signature": "public class Entry\u003CTValue\u003E",
      "startLine": 5,
      "endLine": 10
    },
    {
      "path": "src/Domain/Generics/Collections.cs",
      "qualifiedName": "Cache::Entry::Key",
      "kind": "csharp_property",
      "signature": "TKey? Key",
      "startLine": 7,
      "endLine": 7
    },
    {
      "path": "src/Domain/Generics/Collections.cs",
      "qualifiedName": "Cache::Entry::Value",
      "kind": "csharp_property",
      "signature": "TValue? Value",
      "startLine": 9,
      "endLine": 9
    },
    {
      "path": "src/Domain/Generics/Collections.cs",
      "qualifiedName": "Index",
      "kind": "class",
      "signature": "public class Index\u003CTKey\u003E",
      "startLine": 13,
      "endLine": 21
    },
    {
      "path": "src/Domain/Generics/Collections.cs",
      "qualifiedName": "Index::Entry",
      "kind": "inner_class",
      "signature": "public class Entry\u003CTValue\u003E",
      "startLine": 15,
      "endLine": 20
    },
    {
      "path": "src/Domain/Generics/Collections.cs",
      "qualifiedName": "Index::Entry::Key",
      "kind": "csharp_property",
      "signature": "TKey? Key",
      "startLine": 17,
      "endLine": 17
    },
    {
      "path": "src/Domain/Generics/Collections.cs",
      "qualifiedName": "Index::Entry::Position",
      "kind": "csharp_property",
      "signature": "int Position",
      "startLine": 19,
      "endLine": 19
    },
    {
      "path": "src/Domain/Generics/Repository.cs",
      "qualifiedName": "IRepository",
      "kind": "interface",
      "signature": "public interface IRepository\u003CT\u003E",
      "startLine": 3,
      "endLine": 8
    },
    {
      "path": "src/Domain/Generics/Repository.cs",
      "qualifiedName": "IRepository::FindAsync",
      "kind": "method",
      "signature": "Task\u003CT?\u003E FindAsync(Guid id, CancellationToken cancellationToken)",
      "startLine": 5,
      "endLine": 5
    },
    {
      "path": "src/Domain/Generics/Repository.cs",
      "qualifiedName": "IRepository::SaveAsync",
      "kind": "method",
      "signature": "Task SaveAsync(Guid id, T item, CancellationToken cancellationToken)",
      "startLine": 7,
      "endLine": 7
    },
    {
      "path": "src/Domain/Generics/Repository.cs",
      "qualifiedName": "InMemoryRepository",
      "kind": "class",
      "signature": "public class InMemoryRepository\u003CT\u003E : IRepository\u003CT\u003E",
      "startLine": 10,
      "endLine": 26
    },
    {
      "path": "src/Domain/Generics/Repository.cs",
      "qualifiedName": "InMemoryRepository::_items",
      "kind": "field",
      "signature": "private readonly Dictionary\u003CGuid, T\u003E _items = new();",
      "startLine": 12,
      "endLine": 12
    },
    {
      "path": "src/Domain/Generics/Repository.cs",
      "qualifiedName": "InMemoryRepository::FindAsync",
      "kind": "method",
      "signature": "public Task\u003CT?\u003E FindAsync(Guid id, CancellationToken cancellationToken)",
      "startLine": 14,
      "endLine": 18
    },
    {
      "path": "src/Domain/Generics/Repository.cs",
      "qualifiedName": "InMemoryRepository::SaveAsync",
      "kind": "method",
      "signature": "public Task SaveAsync(Guid id, T item, CancellationToken cancellationToken)",
      "startLine": 20,
      "endLine": 25
    },
    {
      "path": "src/Domain/Money.cs",
      "qualifiedName": "Money",
      "kind": "class",
      "signature": "public sealed class Money",
      "startLine": 4,
      "endLine": 21
    },
    {
      "path": "src/Domain/Money.cs",
      "qualifiedName": "Money::Money",
      "kind": "constructor",
      "signature": "public Money(decimal amount, string currency)",
      "startLine": 6,
      "endLine": 10
    },
    {
      "path": "src/Domain/Money.cs",
      "qualifiedName": "Money::Amount",
      "kind": "csharp_property",
      "signature": "decimal Amount",
      "startLine": 12,
      "endLine": 12
    },
    {
      "path": "src/Domain/Money.cs",
      "qualifiedName": "Money::Currency",
      "kind": "csharp_property",
      "signature": "string Currency",
      "startLine": 14,
      "endLine": 14
    },
    {
      "path": "src/Domain/Money.cs",
      "qualifiedName": "Money::Zero",
      "kind": "method",
      "signature": "public static Money Zero(string currency) =\u003E new(0m, currency)",
      "startLine": 16,
      "endLine": 16
    },
    {
      "path": "src/Domain/Money.cs",
      "qualifiedName": "Money::Add",
      "kind": "method",
      "signature": "public Money Add(Money other) =\u003E new(Amount \u002B other.Amount, Currency)",
      "startLine": 18,
      "endLine": 18
    },
    {
      "path": "src/Domain/Money.cs",
      "qualifiedName": "Money::Add",
      "kind": "method",
      "signature": "public Money Add(decimal amount) =\u003E new(Amount \u002B amount, Currency)",
      "startLine": 20,
      "endLine": 20
    },
    {
      "path": "src/Domain/Order.Totals.cs",
      "qualifiedName": "Order",
      "kind": "class",
      "signature": "public partial class Order",
      "startLine": 3,
      "endLine": 15
    },
    {
      "path": "src/Domain/Order.Totals.cs",
      "qualifiedName": "Order::Total",
      "kind": "method",
      "signature": "public Money Total()",
      "startLine": 5,
      "endLine": 14
    },
    {
      "path": "src/Domain/Order.cs",
      "qualifiedName": "Order",
      "kind": "class",
      "signature": "public partial class Order",
      "startLine": 4,
      "endLine": 29
    },
    {
      "path": "src/Domain/Order.cs",
      "qualifiedName": "Order::_lines",
      "kind": "field",